,company,intro,length
940,601718.SH,际华集团股份有限公司生产弹药。该公司生产军装、军用鞋类、保护工具和其他产品。际华 集团还从事资产管理、纺织染料和其他业务。,61
941,601727.SH,上海电气集团股份有限公司生产发电设备。该公司生产和销售热电机组、核电机组、风电设 备、输电与配电设备和其他产品。上海电气集团股份有限公司还生产环保设备。,76
942,601766.SH,中国中车股份有限公司生产轨道车辆产品。该公司生产机车、客运车箱、货运车厢、车辆核 心部件和其它产品。中国中车还提供车辆维修、投资管理和其他服务。,72
943,601777.SH,力帆实业（集团）股份有限公司开发、生产和销售摩托车、汽车和汽油发动机。该公司生产 和销售摩托车、摩托车发动机、乘用车、乘用车发动机、汽油发动机和其他产品。力帆实业 （集团）在全球范围内销售其产品。,98
944,601788.SH,光大证券股份有限公司经营证券业务。该公司提供证券经纪、交易、托管、信用担保、承 销、资产管理和投资咨询服务。光大证券在国内和国际范围内开展业务。,72
945,601789.SH,宁波建工股份有限公司的主营业务包括房屋建筑工程、市政公用工程、建筑装饰装潢和幕墙 工程等各承包工程业务。该公司还涉及建筑设计、钢结构加工、物资物流等多个领域。,79
946,601798.SH,甘肃蓝科石化高新装备股份有限公司的主营业务为石油、石化专用设备的研发、设计、生产 、安装技术服务。该公司的主要产品为石油钻采机械、炼油化工设备、海洋石油设备及轻工 食品机械。,87
947,601799.SH,常州星宇车灯股份有限公司的主营业务为汽车灯具的研发、设计、制造和销售。该公司的主 要产品有前照灯、后组合灯、雾灯、三角警示牌以及其他汽车灯具。,71
948,601800.SH,中国交通建设股份有限公司主要从事基建建设、基建设计、疏浚及港口机械制造业务。该 公司为客户提供涵盖基建项目各阶段的综合解决方案，其业务遍及世界各地。,74
949,601801.SH,安徽新华传媒有限公司批发、零售出版物。公司出版物包括教材、图书、音像制品。公司业 务亦包括进出口业务、物业管理、房屋租赁等。,62
950,601808.SH,中海油田服务股份有限公司提供油田服务。该公司提供地球物理勘探、钻探、油田技术开发 和其他服务。中海油服还从事交通业务。,59
951,601811.SH,新华文轩出版传媒股份有限公司零售书籍和视听产品，分销教科书和补充材料并向图书出版 商提供配套支持和服务。,52
952,601816.SH,京沪高速铁路股份有限公司提供铁路运营服务。该公司提供高铁和高铁站的投资、建造、运 营和其他服务。京沪高速铁路在中国提供服务。,62
953,601818.SH,中国光大银行股份有限公司提供银行服务。该公司提供存款、贷款、国内结算、外汇交易和 其他服务。中国光大银行向个人、企业和其他客户提供服务。,68
954,601828.SH,红星美凯龙家居集团有限公司提供家具装饰服务。该公司提供家具店管理和专业咨询服务。 红星美凯龙集团还经营互联网家装、互联网零售和物流配送业务。,70
955,601838.SH,成都银行股份有限公司提供银行服务。该公司提供存款、贷款、货币交易、外汇和其他服 务。成都银行为个人、企业和其他客户提供服务。,62
956,601857.SH,中国石油天然气股份有限公司是一家石油和天然气公司。该公司提供原油和石油产品勘探、 开发、生产和销售。中国石油还销售石化产品和衍生化学品。,68
957,601858.SH,中国科技出版传媒股份有限公司提供科学技术出版服务。该公司出版生物学、数学、物理、 化学、天文学和地质学领域的书籍。,57
958,601860.SH,江苏紫金农村商业银行股份有限公司经营商业银行业务。该公司提供存款、贷款、结算、票 据贴现、信贷保险、贸易融资等银行服务。江苏紫金农村商业银行为企业和个人提供服务。,81
959,601865.SH,福莱特玻璃集团股份有限公司生产玻璃制品。该公司主要生产和销售光伏玻璃、浮法玻璃、 工程玻璃、家居玻璃等。福莱特玻璃集团为中国和香港的客户服务。,71
960,601866.SH,中远海运发展股份有限公司是以中国为基地的集装箱运输公司。 该公司拥有、租赁及经营 集装箱船舶， 以提供国际及国内集装箱航运服务。,64
961,601869.SH,长飞光纤光缆股份有限公司生产光纤和光缆产品。本公司生产通信光纤、通信电缆、特种纤 维光纤等产品。长飞光纤光缆的产品销售至全中国和全世界。,68
962,601872.SH,招商局能源运输股份有限公司主要从事远洋油轮及散货船运输，并通过下属的合营企业CLNG 公司参与液化天然气专用船运输业务。,60
963,601877.SH,浙江正泰电器股份有限公司主要从事配电电器、终端电器、控制电器、电源电器、电子电器 五大类低压电器产品的研发、生产和销售。,60
964,601878.SH,浙商证券股份有限公司是一家证券经纪公司。该公司提供证券经纪、投资银行、资产管理、 投资咨询、证券交易和基金代销服务。浙商证券还从事融资和期货业务。,73
965,601880.SH,大连港股份有限公司提供物流服务。该公司提供集装箱装卸、集装箱运输和其他服务，还经 营原油仓储、货物运输和其他业务。大连港为香港的客户提供服务。,71
966,601881.SH,中国银河证券股份有限公司提供证券服务。该公司提供证券承销、证券经纪、证券投资咨 询、证券交易等服务。中国银河证券在中国各地提供服务。,66
967,601882.SH,宁波海天精工股份有限公司是一家工业机械制造厂。该公司提供各种产品，如落地式镗铣， 数控车床和车削。,49
968,601886.SH,江河创建集团股份有限公司提供工程建设服务。该公司提供幕设墙工程和室内装饰服务。江 河创建集团还从事医疗保健业务。,56
969,601888.SH,中国国旅股份有限公司主要经营旅游业务。业务包括入境游、出境游、国内游、票务代理和 签证等传统业务以及旅游电子商务、商务会奖旅游、海洋旅游、旅行救援等新兴业务和专项 旅游业务。 该公司还经营免税商品业务。,101
970,601890.SH,江苏亚星锚链股份有限公司主营业务为船用锚链及系泊链的生产和销售。该公司的主要产品 为船用锚链、海洋平台系泊链及相关附件。,60
971,601898.SH,中国中煤能源股份有限公司开采和加工煤炭产品。该公司生产动力煤和炼焦煤产品。中煤能 源还从事煤化学品生产、煤炭开采设备制造、坑口发电和煤矿设计等业务。,74
972,601899.SH,紫金矿业股份有限公司经营金属矿产资源勘探和开采业务。该公司生产黄金、铜、锌、铁和 其他基本金属。紫金矿业还在国内和国际范围内开展金属贸易和投资业务。,74
973,601900.SH,南方出版传媒股份有限公司是一家传媒公司，该公司从事各种出版、网络媒体和印刷等多种 媒体业务。,46
974,601901.SH,方正证券股份有限公司提供金融服务。该公司提供证券经纪、投资咨询、证券交易、专有交 易、证券资产管理、投资基金代销和其他服务。方正证券股份有限公司在中国提供服务。,80
975,601908.SH,北京京运通科技股份有限公司经营发电业务。该公司生产和分销电力、风电和其他电力产 品。北京京运通科技还生产硅产品。,56
976,601916.SH,浙商银行股份有限公司提供银行服务。该公司提供存款、贷款、国际结算、财富管理和其他 服务。浙商银行还从事金融服务。,56
977,601918.SH,中煤新集能源股份有限公司提供煤炭开采服务。该公司主要从事煤炭产品的开采、加工和销 售。中煤新集能源还提供火力发电服务。,59
978,601919.SH,中远海运控股股份有限公司提供运输服务。该公司提供集装箱运输、货站运营、散货运输和 集装箱租赁服务。中远海控在全球范围内开展业务。,64
979,601928.SH,江苏凤凰出版传媒股份有限公司的主营业务为图书出版物及音像制品的出版、发行及文化用 品销售。该公司的主要产品包括教材、教辅和一般图书。,66
980,601929.SH,吉视传媒股份有限公司建设、管理和维护有线电视网络。该公司提供基本的广播电视传输服 务、数字电视增值服务、双向互动宽带服务和有线网络服务。吉视传媒在中国提供服务。,80
981,601933.SH,永辉超市股份有限公司主营业务为超市的连锁经营。该公司是以经营大卖场、卖场及社区超 市为核心业务。,48
982,601939.SH,中国建设银行股份有限公司提供银行服务。该公司提供存款、贷款、基金管理、外汇和其他 服务。中国建设银行向个人、企业和其他客户提供服务。,66
983,601949.SH,中国出版传媒股份有限公司是一家出版公司。该公司主要出版、发行和印刷书籍、报纸等。 中国出版传媒在中国提供服务。,55
984,601952.SH,江苏省农垦农业发展股份有限公司是一家农业公司。 该公司利用现代农业技术来种植谷 物、水果和其他作物。,50
985,601958.SH,金堆城钼业股份有限公司从事钼矿采矿、采选、熔炼、加工和交易。该公司供应钼负载、钼 精矿、铜制品、钼化学品、钼金属、铅锌和其他产品。金堆城钼业股份有限公司在国内外销 售其产品。,87
986,601965.SH,中国汽车工程研究院股份有限公司的主营业务为汽车产品研发及咨询业务、汽车测试与评价 业务、产业化制造及销售业务。该公司的主要产品包括自卸车、混凝土搅拌车及环卫车等。,81
987,601966.SH,玲珑轮胎在制造业经营业务。 该公司设计、生产和销售各种轮胎，用于商业和建筑车辆。 玲珑轮胎行销全球。,50
988,601968.SH,"上海宝钢包装股份有限公司设计, 研发并生产食品、饮料等快速消费品的金属包装。公司也 提供相关的解决方案服务。",54
989,601969.SH,海南矿业股份有限公司提供铁矿石开采服务。该公司生产铁矿石，包括块矿、粉矿和铁粉。 海南矿业股份有限公司为钢铁行业提供产品。,61
990,601975.SH,中国长江航运集团南京油运股份有限公司主要提供以石油及化学制品为主的水上运输服务。 该公司还提供相应的仓储服务。,55
991,601985.SH,中国核能电力股份有限公司是核电供应商。公司投资、建筑、管理、运营中国各地的核电站 。,42
992,601988.SH,中国银行股份有限公司提供银行服务。该公司提供存款、贷款、外汇交易、资金结算和其他 服务。中国银行为个人、企业和其他客户提供服务。,64
993,601989.SH,中国船舶重工股份有限公司是一家船舶制造商。该公司生产海军舰艇、军舰柴油发动机、舰 载武器发射器、导航设备、通信设备和其他军用战舰装备。中国船舶重工还从事船舶改造和 修理业务。,87
994,601990.SH,南京证券股份有限公司经营证券业务。该公司提供证券经纪、证券承销、资产管理、信用交 易、金融衍生品交易和互联网金融服务。南京证券主要在中国开展业务。,73
995,601991.SH,大唐国际发电股份有限公司提供发电服务。该公司提供电力项目开发、输电和配电服务。大 唐国际发电还从事煤、煤化学、运输和回收业务。,63
996,601992.SH,北京金隅集团股份有限公司生产水泥制品。该公司生产石膏水泥、预拌混凝土、水泥熟料、 骨料和其他产品。北京金隅集团股份有限公司还经营商业贸易、房地产开发、房地产投资等 业务。,85
997,601996.SH,广西丰林木业集团股份有限公司主要从事中（高）密度纤维板、胶合板的生产销售以及营林 造林业务。,46
998,601997.SH,贵阳市商业银行股份有限公司是一家商业银行。该公司提供存款、贷款、结算、信用担保、 融资汇款、投资和其他银行服务。贵阳银行为企业和个人提供服务。,71
999,601998.SH,中信银行股份有限公司提供银行服务。该公司提供存款、贷款、国内结算、外汇交易、银行 担保和其他服务。中信银行向个人、企业和其他客户提供服务。,69
1000,601999.SH,北方联合出版传媒（集团）股份有限公司从事出版物出版，发行，票据印刷及印刷物资供应 等业务。,45
1001,603000.SH,人民网股份有限公司的主营业务为互联网广告业务、信息业务、移动增值业务及技术服务。 该公司的主要产品包括原创信息、政府信息服务、舆情研究咨询、手机报及ISP服务等。,81
1002,603001.SH,浙江奥康鞋业股份有限公司的主营业务为皮鞋及皮具产品的研发、生产、分销及零售业务。 该公司的主要产品包括商务正装鞋、休闲鞋等皮鞋，以及皮箱和皮夹等皮具。,75
1003,603002.SH,宏昌电子材料股份有限公司的主营业务为电子级环氧树脂的生产和销售。该公司的主要产品 包括液态型、固态型、溶剂型及阻燃型环氧树脂。,63
1004,603003.SH,上海龙宇燃油股份有限公司的主营业务为船用燃料油的采购、运输、仓储、调合加工及销 售。该公司的主要产品包括调合燃料油及非调合燃料油。,65
1005,603005.SH,苏州晶方半导体科技股份有限公司的主营业务为提供晶圆级芯片尺寸封装及测试服务。公司 的主要产品包括影像传感芯片、环境光感应芯片、医疗电子器件、微机电系统（MEMS）、射 频识别芯片（RFID）等。,97
1006,603006.SH,上海联明机械股份有限公司主要为各种工业提供工业产品设计，装配，质量控制。,36
1007,603007.SH,江苏花王园艺股份有限公司主要从事 市政园林景 观、旅游道路绿化和地产市政园林景 观 、旅游道路绿化和地产市政园林景 观、旅游道路绿化和地产观等领域的园林绿化工 程施和 设计业务。,89
1008,603008.SH,喜临门家具股份有限公司的主营业务为床垫、软床及其他家具产品的设计研发、生产和销 售。该公司的主要产品为床垫。,54
1009,603009.SH,上海北特科技股份有限公司的主营业务为汽车转向器零部件与减震器零部件的研发、生产与 销售。该公司的主要产品包括汽车转向器及减震器的零部件。,68
1010,603010.SH,浙江万盛股份有限公司主要从事有机磷系阻燃剂的研发、生产和销售。,31
1011,603011.SH,合肥合锻智能制造股份有限公司主要从事智能检测分选装备的研发、生产和销售业务。,38
1012,603012.SH,上海创力集团股份有限公司是一间以煤炭综合采掘机械设备为主的煤机装备供应商。公司的 主营业务为煤炭综合采掘机设备、煤矿自动化控制系统以及矿用电器设备的设计、研发、制 造、销售以及技术服务。,93
1013,603013.SH,亚普汽车部件股份有限公司生产汽车燃料系统。该公司研究、设计、开发、生产和销售汽车 油箱及相关零部件。亚普汽车部件公司向中国的汽车制造业提供其产品。,73
1014,603015.SH,宁波弘讯科技股份有限公司的主营业务为塑料机械自动化产品的研发、生产和销售。本公司 专注于为中高端塑料机械制造商提供优质的自动化系统解决方案。,70
1015,603016.SH,无锡新宏泰电器科技股份有限公司设计和生产各种类型电子电机及电机配件。,34
1016,603017.SH,中衡设计集团股份有限公司隶属于工程技术服务业，主要从事建筑领域的工程设计、工程总 承包、工程监理及项目管理业务。,56
1017,603018.SH,江苏省交通规划设计院股份有限公司是一家工程咨询公司。该公司咨询业务的范围包括：道 路，桥梁，隧道，铁路，铁路，港口，航道，船闸，工业与民用建筑，环境，景观，智能交 通规划，咨询，勘察，设计，研究，测试，监督，及项目管理。,110
1018,603019.SH,曙光信息产业股份有限公司，研究，开发，并生产信息产品。该公司还销售计算机和服务器 。,42
1019,603020.SH,爱普香料集团股份有限公司生产香料、香精和食品添加剂。该公司生产生物发酵香料、合成 香料、自然香料等。爱普香料集团股份有限公司在奶制品、饮料、糖果、烘焙、个人护理和 其他领域供应其产品。,92
1020,603021.SH,山东华鹏玻璃股份有限公司生产压吹玻璃，其产品为中高档玻璃器皿和玻璃瓶。,35
1021,603022.SH,上海新通联包装股份有限公司研发并设计包装解决方案，并提供包装服务。该公司为各种企 业生产木制、纸制、泡沫和塑料包装物。该公司为世界各地的客户提供服务。,75
1022,603023.SH,哈尔滨威帝电子股份有限公司的主营业务为汽车电子产品的研发、设计、制造与销售。公司 的主要产品包括CAN 总线控制系统、总线及ECU 控制单元、组合仪表、传感器等系列产品。,85
1023,603025.SH,北京大豪科技股份有限公司主要从事于中国研发，生产和销售电脑控制系统，摆动和针织机 。,42
1024,603026.SH,山东石大胜华化工股份有限公司生产销售有机化学产品。公司生产的产品包括环氧丙烷，丙 烯碳酸酯，碳酸二甲酯，丙二醇，碳酸乙烯酯，碳酸甲乙酯和碳酰肼。公司产品出口至欧洲 、美洲、日本、韩国和东南亚。,96
1025,603027.SH,千禾味业食品股份有限公司从事酱油，食醋等调味品和焦糖色等食品添加剂的研发，生产和 销售。,44
1026,603028.SH,江苏赛福天钢索股份有限公司是一家生产钢制品的厂家。这个公司设计和生产电梯钢丝绳， 起重机钢丝绳和吊配件。,52
1027,603029.SH,山东天鹅棉业机械股份有限公司以棉花加工成套设备及配件的研发、生产和销售为主业。,39
1028,603030.SH,上海全筑建筑装饰集团股份有限公司是一个装修整体解决方案的提供商，业务范围涵盖施工 ，建筑设计，家具制造和建筑技术。,57
1029,603031.SH,安徽安德利百货股份有限公司主要从事自营百货零售，亦经营购物中心、超市及家电专业店 等。,43
1030,603032.SH,德力西新疆交通运输集团股份有限公司是一家道路旅客运输公司，主要业务包括道路旅客运 输业务和客运汽车站业务。,53
1031,603033.SH,三维股份生产橡胶产品。 该公司设计、生产和销售由涤纶、涤纶棉、尼龙及其他织物制造 的传送带和传送带产品。 三维股份服务于全球客户。,65
1032,603035.SH,常熟市汽车饰件股份有限公司主要从事研发、生产和销售乘用车内饰件业务。公司产品主要 集中于汽车非金属内饰零部件，主要有门内护板、仪表板/副仪表板、天窗遮阳板、衣帽架 、门柱、行李厢内饰、储物盒、备胎盖、地毯和隔音垫等内饰产品。,112
1033,603036.SH,如通股份生产工业设备。 该公司设计、生产和销售钻井和油井服务，以及悬挂、禁固和夹 紧工具。 如通股份的客户遍布全球。,58
1034,603037.SH,上海凯众材料科技股份有限公司生产汽车零部件和配件。,25
1035,603038.SH,华立实业有限公司是一家封边公司。产品包括封边装饰材料、异型装饰材料和其他装饰材料 ，主要应用于板式家具的封边、表面装饰及室内装修装饰等。,68
1036,603039.SH,上海泛微网络科技股份有限公司属于信息技术行业。该公司提供企业级应用和基于网络的信 息管理软件，电子商务解决方案，咨询以及技术支持服务。上海泛微网络服务的客户遍及中 国。,84
1037,603040.SH,杭州新坐标科技股份有限公司主营业务为精密冷锻件的研发、生产和销售。,33
1038,603041.SH,江苏美思德化学股份有限公司生产特种化学品。该公司主要开发，生产，和销售有机硅表面 活性剂。江苏美思德化学在全球范围内销售其产品。,64
1039,603042.SH,南京华脉科技股份有限公司生产和销售通讯设备。本公司主要生产通讯接线 设备、综合布线设备、室内配电系统、微波无源器件等设备。南京华脉科技还经营 通讯设备租赁。,78
1040,603043.SH,广州酒家集团股份有限公司在中国经营中餐和粤菜餐馆。,25
1041,603045.SH,福达合金材料股份有限公司开发、生产和分销合金接触材料。该公司生产接触铆钉、触头、 接触元件、银合金线、钎焊材料和其他相关产品。福达合金在全球范围内销售其产品。,79
1042,603050.SH,石家庄科林电气股份有限公司是为电力行业、公共事业及大型行业客户提供电力系统一、二 次完整解决方案、优质产品和服务的重点高新技术企业。本公司的主要产品有数字化智能变 电站系统、综合自动化系统、调度自动化系统、电能量采集系统、智能电度表及配电仪表、 高低 压预付费系统、高低压开关柜、户外真空断路器等电力产品。石家庄科林电气销售其 产品到亚洲、东南亚及非洲等地区。,180
1043,603053.SH,成都燃气集团股份有限公司提供城市天然气供应服务。该公司提供城市天然气传输、城市天 然气配送和其他相关服务。成都燃气集团还提供城市天然气项目规划、天然气设备检查、天 然气设备分销服务。,91
1044,603055.SH,浙江台华新材料股份有限公司是一家化纤产品制造公司。该公司生产和销售尼龙、涤纶运动 服、羽绒服、休闲服饰、工业和箱包织物产品。台华新材在全球各地销售其产品。,77
1045,603056.SH,德邦物流股份有限公司提供物流服务。该公司提供零担运输、仓储管理、包裹寄送、存储、 陆运、快递服务和货物跟踪服务。德邦物流还提供软件开发服务。德邦物流为全球客户提供 服务。,85
1046,603058.SH,永吉股份生产印刷产品。 该公司设计、加工和销售光刻、卷烟标牌及其他相关印刷包装产 品。 永吉的客户遍及中国各地。,56
1047,603059.SH,倍加洁集团股份有限公司生产口腔清洁护理产品。该公司生产和销售牙刷、牙线、漱口水、 口腔喷雾、湿巾、牙膏和其他产品。倍加洁集团在中国各地销售其产品。,73
1048,603060.SH,中国建材检验认证集团股份有限公司测试，认证水泥，安全玻璃和各种陶瓷产品的强度和性 能。,43
1049,603063.SH,"深圳市禾望电气股份有限公司生产电力设备。该公司主要设计，开发，生产, 和销售风电变 流器，光伏逆变器, 特种电源产品等。深圳市禾望电气为广电, 汽车制造，造纸等行业的客 户提供服务。",91
1050,603066.SH,音飞储存有限公司主要研发存储设备，生产各种用于存储的货架。,29
1051,603067.SH,湖北振华化学股份有限公司通过其专有的制造技术生产铬盐。,27
1052,603068.SH,博通集成电路（上海）股份有限公司制造无线连接芯片产品。该公司生产和销售无线音频类 产品、无线数据传输类产品、无线键盘芯片、无人机无线遥控芯片、蓝牙音响芯片和其他产 品。博通集成向电话、内部通讯系统、安全监控和其他领域提供其产品。,114
1053,603069.SH,海汽集团的主营业务为道路旅客运输服务。,19
1054,603076.SH,宁波乐惠国际工程装备股份有限公司是一家酿酒设备制造公司。该公司生产并销售大规模酿 酒设备、工艺酿造设备、包装系统和其他产品。宁波乐惠国际工程装备还提供食品消毒服 务。,83
1055,603077.SH,四川和邦生物科技股份有限公司生产化学品。该公司生产和销售纯碱（碳酸钠）、氯化铵和 其他产品。四川和邦生物科技股份有限公司还生产调味品。,67
1056,603078.SH,江阴江化微电子材料股份有限公司是一家无锡科技领军、国家高新技术企业。本公司专业生 产适用于半导体、晶体硅太阳能、平板显示以及LED、硅片、锂电池、光磁等工艺制造过程 中的专用湿电子化学品超净高纯试剂、光刻胶配套试剂。江阴江化微电子材料产品主要服务 于微电子、光电子领域。,135
1057,603079.SH,浙江圣达生物药业股份有限公司是一家制药公司。该公司生产和销售叶酸、维他命、活性药 物成分和硝酸咪康唑。浙江圣达生物的产品行销中国各地。,67
1058,603080.SH,新疆火炬燃气股份有限公司提供天然气配送服务。该公司提供燃气输送、燃气配送、管道维 护和其他相关服务。新疆火炬燃气股份有限公司还销售管道配件、燃气电器和配件。,78
1059,603081.SH,浙江大丰实业股份有限公司发展文化体育设施。该公司集成声音，照明，装饰，座位以及更 多的设施。浙江大丰实业服务世界各地客户。,61
