,company,intro,length
1910,000869.SZ,烟台张裕葡萄酿酒股份有限公司酿制、生产和销售葡萄酒、白兰地、香槟酒和保健酒。该公 司的主要产品包括干红、干白葡萄酒、XO级、VSOP级、VO级、VS级白兰地等酒。,81
1911,000875.SZ,吉林电力股份有限公司经营发电业务。该公司生产和分销电力、热力和其他能源产品。吉电 股份还生产光伏产品。,51
1912,000876.SZ,新希望六和股份有限公司生产动物饲料产品。该公司生产和销售猪饲料、鸡饲料、鸭饲料、 水产饲料和其他相关产品。新希望六和股份有限公司还提供肉类加工和金融投资服务。,79
1913,000877.SZ,新疆天山水泥股份有限公司生产和销售各类水泥及其相关产品。该公司的产品包括普通水 泥、复合水泥、硅酸水泥、混凝土、熟料和其他相关产品。,66
1914,000878.SZ,云南铜业股份有限公司主要生产和加工电解铜。该公司的产品包括阴极铜、铜线坯、黄金、 白银、硫酸及其他副产品。,53
1915,000880.SZ,潍柴重机股份有限公司制造和销售运输设备发动机及相关部件。该公司生产柴油发动机、发 电机组、齿轮箱和相关配件。潍柴重机在国内外销售其产品。,68
1916,000881.SZ,中广核核技术发展股份有限公司研究、开发、制造并分销改良聚合物材料。该公司生产改良 的有线聚合材料、改良的工程塑料和其他材料。中广核核技术发展还经营电子加速器和辐 照、进出口及其他业务。,92
1917,000882.SZ,北京华联商厦股份有限公司经营租赁业务。该公司提供购物中心租赁服务和其他服务。北京 华联商厦股份有限公司还从事购物中心管理、物业管理、电影院运营和其他业务。,77
1918,000883.SZ,湖北能源集团股份有限公司经营公用事业网络。该公司提供水电、热电、核电和其他电力产 品。湖北能源集团还从事金融、贸易和其他业务。,63
1919,000885.SZ,河南城发环境股份有限公司提供工程建设和运营服务。该公司开发并运营高速公路和其他基 础设施设施。河南城发环境还生产水泥和熟料产品。,64
1920,000886.SZ,海南高速公路股份有限公司主要建设和管理海南高速公路。该公司兼营商品贸易、汽车客货 运输和房地产等。,49
1921,000887.SZ,安徽中鼎密封件股份有限公司主要从事液压气动密封件、汽车非轮胎橡胶制品 （制动、减震除外）生产和销售。,50
1922,000888.SZ,峨眉山旅游股份有限公司提供旅游服务。该公司提供景区门票销售、旅游纪念品销售、旅游 酒店管理等服务。峨眉山旅游股份有限公司还经营载客缆车管理、房地产贷款及其他业务。,81
1923,000889.SZ,中嘉博创股份有限公司提供信息技术维护服务。该公司提供信息系统集成、网络组件维护和 其他服务。中嘉博创还提供技术开发、信息技术咨询、电信工程开发和其他服务。,77
1924,000890.SZ,江苏法尔胜股份有限公司生产和销售钢丝、钢丝绳、普通机械、电线电缆、电子产品、光 纤、光缆、光传感元器件和其他相关产品。,59
1925,000892.SZ,欢瑞世纪联合股份有限公司主要从事通信产业。该公司经销CDMA移动电话、提供通信系统集 成和宽带网接入服务，并生产通信设备。,61
1926,000893.SZ,广州东凌国际投资股份有限公司销售粮食、饲料，货物进出口、技术进出口；以自有资金投 资；仓储；批发、零售食用油。,55
1927,000895.SZ,河南双汇投资发展股份有限公司是一家投资控股公司。通过其子公司，该公司生产肉制品和 生鲜冻品，提供加工和印刷服务，并从事商业贸易。,64
1928,000897.SZ,天津津滨发展股份有限公司是一家综合经营公司。该公司提供建筑机具的租赁、销售各类物 资商品和房屋、供应热电并提供各类技术咨询服务。,64
1929,000898.SZ,鞍钢股份有限公司生产钢材产品，包括冷轧板、钢轨、管坯、盘条、厚板和其他钢铁产品。,40
1930,000899.SZ,江西赣能股份有限公司主要从事电力生产。该公司还投资于节能项目并提供锅炉安装和维修 服务。,44
1931,000900.SZ,现代投资股份有限公司提供基础设施建设和投资服务。现代投资股份有限公司经营和维护收 费公路、桥梁、隧道和渡口。现代投资在国内开展业务。,66
1932,000901.SZ,航天科技控股集团股份有限公司生产和销售汽车电子仪表和产品、微电机、航天产品、环保 监测设备、藝術品和其他相关产品。,57
1933,000902.SZ,湖北新洋丰肥业股份有限公司是一家大型民营企业，其主导产品为高浓度磷肥与复肥料。,39
1934,000903.SZ,昆明云内动力股份有限公司生产工业发动机。该公司生产柴油发动机、内燃机、柴油机组和 其他产品。昆明云内动力股份有限公司将其产品销往欧洲、南美、非洲、东南亚以及其他国 家和地区。,87
1935,000905.SZ,厦门港务发展有限公司提供港口运营服务。该公司提供港口开发、货物装卸、仓储和其他港 口物流服务。厦门港务发展还在国内从事贸易和供应链业务。,68
1936,000906.SZ,浙商中拓集团股份有限公司是一家金属制品批发公司。该公司销售钢铁、铁合金、锰、镍等 产品。浙商中拓集团还从事汽车销售业务。,60
1937,000908.SZ,湖南景峰医药股份有限公司开发药品。该公司生产和销售化学药品、生物药品、中药和其他 相关产品。湖南景峰医药在中国各地销售其产品。,63
1938,000909.SZ,数源科技股份有限公司主要从事彩色电视机的生产和销售业务。该公司拥有“西湖”品牌。 数源科技还销售房地产，提供网络集成服务和设备维修服务。,68
1939,000910.SZ,大亚圣象家居股份有限公司生产地板。该公司生产和销售复合地板、三层实木地板、多层实 木地板及其他相关产品。大亚圣象还生产高密度纤维板和颗粒板。,70
1940,000911.SZ,南宁糖业股份有限公司生产并销售糖产品。该公司生产机制糖、蔗渣纸浆、蔗糖蜜、原糖和 其他产品。南宁糖业还生产复合肥、酒精、纸制品和其他产品。,69
1941,000912.SZ,四川泸天化股份有限公司生产和销售化肥和工业化学产品。该公司生产尿素、复合肥、液 氨、甲醇、二甲醚、稀硝酸等化工产品。四川泸天化在中国销售其产品。,72
1942,000913.SZ,浙江钱江摩托股份有限公司生产和销售钱江牌摩托车及其零部件和电动自行车。该公司还提 供维修服务。,47
1943,000915.SZ,山东山大产业集团有限公司开发山东大学国家大学科技园，生产二氧化氯发生器、通信网络 系统和工业自动控制系统，并开发计算机软件。该公司也从事医药产品生产。该公司使用“ 山大华特”品牌。,90
1944,000917.SZ,湖南电广传媒股份有限公司设计、生产和播放电视广告，并提供广告代理服务。该公司还出 售电视节目、经营主题公园、并提供有线电视网络节目的服务。湖南电广传媒在中国提供服 务。,84
1945,000918.SZ,嘉凯城集团股份有限公司生产农作物和蔬菜种子、奶制品和生物产品。该公司还开发房地产 、兽药、农用机械和农业技术。,55
1946,000919.SZ,金陵药业股份有限公司主要生产和销售医药产品。该公司的产品包括治疗脉络的脉络宁注射 液和中西药原料药及制剂等。,54
1947,000920.SZ,南方汇通股份有限公司生产过滤产品。该公司生产复合反渗透膜、纳米过滤膜和其他产品。 南方汇通还从事植物纤维综合利用、股权投资和其他业务。,67
1948,000921.SZ,海信家电集团股份有限公司制造和销售家用电器。该公司生产冰箱、空调、冰柜和其他设 备。海信家电集团在全球范围内销售其产品。,60
1949,000922.SZ,哈尔滨电气集团佳木斯电机股份有限公司制造和销售继电器、继电保护装置、自动化产品、 电互感器、电源产品和其他电力产品。该公司使用“阿继”品牌。,70
1950,000923.SZ,河钢资源股份有限公司经营矿产和宝石开采业务。该公司生产磁性矿石、铜、蛭石、阳极泥 等产品。河钢资源股份有限公司还提供推土机、装载机、挖掘机、埋管机、裂土器等产品。,81
1951,000925.SZ,浙江众合科技股份有限公司主要从事节能减排和轨道交通业务的机电产业。,33
1952,000926.SZ,湖北福星科技股份有限公司经营房地产开发业务。该公司提供住房装修、住房贷款、房地产 经纪、物业管理和其他服务。湖北福星科技股份有限公司还生产钢产品。,73
1953,000927.SZ,天津一汽夏利汽车股份有限公司生产和销售汽车。该公司生产运动型多用途车、轿车、跨界 车、电动汽车和汽车零部件。天津一汽夏利在中国各地销售其汽车。,71
1954,000928.SZ,中钢国际工程技术股份有限公司生产和销售炭素和石墨制品。该公司的主要产品是石墨电极 。吉林炭素在世界各地销售其产品。,57
1955,000929.SZ,兰州黄河企业股份有限公司主营啤酒制造业。该公司的产品包括“黄河”牌啤酒、饮料、麦 芽和饲料。,46
1956,000930.SZ,中粮生物科技股份有限公司生产、加工和销售农副产品。该公司提供燃料乙醇、食用酒精、 淀粉、变性淀粉、淀粉糖、柠檬酸、味精、聚乳酸及其副产品等。中粮生物科技在中国销售 其产品。,86
1957,000931.SZ,北京中关村科技发展（控股）股份有限公司主要开发住宅和办公楼。通过其子公司，该公司 还从事生物医药生产并提供通信服务。,58
1958,000932.SZ,湖南华菱钢铁股份有限公司主要从事炼钢、轧钢和有色金属的压延加工及其产品的销售业 务。该公司的产品包括钢坯、无缝钢管、铝管线和其他的金属材料等。华菱管线的产品销售 国内及远销美国，韩国，泰国等国家和地区。,101
1959,000933.SZ,河南神火煤电股份有限公司从事煤炭开采和生产业务。该公司还提供发电、电解铝生产以及 铸造焦炭处理服务。河南神火煤电股份有限公司在国内和国外开展业务。,73
1960,000935.SZ,四川双马水泥股份有限公司生产和销售水泥及水泥制品。通过其子公司，该公司兼营电力生 产和建筑材料贸易。,50
1961,000936.SZ,江苏华西村股份有限公司制造和销售纺织材料。该公司生产织织面料、聚酯短纤维、粗纺毛 纱等产品。江苏华西村股份有限公司还经营投资管理、国内贸易、金融信息咨询等业务。,80
1962,000937.SZ,冀中能源股份有限公司生提供煤炭开采和洗选服务。该公司生产动力煤、炼焦煤和其他煤制 化学品。冀中能源股份有限公司还从事建筑材料批发、发电和贸易服务。,73
1963,000938.SZ,清华紫光股份有限公司生产电子产品。该公司市生产电脑产品、扫描仪及其他产品。清华紫 光还提供系统集成、数据处理及其他服务。,60
1964,000948.SZ,云南南天电子信息产业股份有限公司生产金融业专用设备、开发计算机软件并提供系统集成 和网络工程服务。该公司的产品包括存折打印机、磁卡读写器、自动柜员机等金融设备。,80
1965,000949.SZ,"新乡化纤股份有限公司从事粘胶纤维的生产和销售。公司的产品包括粘胶长丝、粘胶短纤 维, 纱, 线和连续纺粘胶长丝等。",57
1966,000950.SZ,重药控股股份有限公司批发药物。该公司分销抗生素、呼吸道药物、心血管药物、维生素 片、医疗保健药物等相关产品。重药控股股份有限公司还提供医疗设备批发、终端配送、仓 储物流服务。,87
1967,000951.SZ,中国重汽集团济南卡车股份有限公司主要从事重型卡车制造及销售。,30
1968,000952.SZ,湖南广济药业股份有限公司主要从事维生素B2的生产和销售业务。该公司还生产抗厌氧菌原 料药、片剂和针剂等。,52
1969,000953.SZ,广西河池化工股份有限公司主要生产和销售各种化肥产品，包括尿素、复合肥和液氨等。该 公司还从事水产养殖和电子产品制造。,58
1970,000955.SZ,欣龙控股（集团）股份有限公司主要从事无纺布及其它产品的生产和销售业务。该公司的业 务包括水刺无纺布、热轧无纺布、电解铜、手机等。欣龙控股拥有“欣龙”品牌。,77
1971,000957.SZ,中通客车控股股份有限公司设计、生产和销售乘用车。该公司生产客车、城市巴士、团体 车、豪华商务巴士、物流车和电动巴士产品。中通客车控股在全球范围内销售其产品。,78
1972,000958.SZ,国家电投集团东方新能源股份有限公司供应热力和电力。该公司生产、输送和分配电力和热 力。东方能源在中国开展业务。,55
1973,000959.SZ,北京首钢股份有限公司生产和销售钢材产品。该公司生产和销售轧钢、钢坯和其他钢材产 品。北京首钢在中国各地销售其产品。,57
1974,000960.SZ,云南锡业股份有限公司从事有色金属产品的加工和出口。该公司生产锡锭、锌、铜和铅制 品。云南锡业还从事深加工和贸易业务。,58
1975,000961.SZ,江苏中南建设集团有限公司经营房地产开发业务。该公司提供房屋翻修、房屋贷款、房地产 经纪和其他服务。江苏中南建设集团还经营工业投资业务。,67
1976,000962.SZ,宁夏东方钽业股份有限公司冶炼和加工稀有金属材料，包括钽、铌、和铍合金。该公司的产 品用于电子、冶金、化工和航天工业。,58
1978,000965.SZ,天津天保基建股份有限公司经营房地产业务。该公司提供住房装修、住房贷款、房地产经 纪、物业管理和其他服务。天津天保基建还从事基础设施建设、投资和其他业务。,76
1979,000966.SZ,国电长源电力股份有限公司主要从事水力和火力发电及热力生产。,29
1980,000967.SZ,盈峰环境科技集团股份有限公司开发、生产和销售各类通风及制冷设备。该公司的产品包括 轴流风机、混流风机、离心风机及水冷、风冷制冷设备。,66
1981,000968.SZ,山西蓝焰控股股份有限公司经营煤炭业务。该公司提供煤矿甲烷地面开采、矿产资源勘探和 其他业务。山西蓝焰控股股份有限公司还从事煤矿瓦斯治理、煤层气工程设计和其他业务。,81
1982,000969.SZ,安泰科技股份有限公司生产和销售新材料。该公司生产超硬材料、功能材料、耐火材料、粉 末材料和磁性材料等产品。安泰科技还生产工业机械设备、电子元器件等产品。,76
1983,000970.SZ,北京中科三环高技术股份有限公司主要开发和生产稀土永磁材料和产品。该公司的主要产品 是钕铁硼磁性材料。,50
1984,000971.SZ,高升控股股份有限公司主要从事毛毯和精毛纺呢绒面料的开发、生产和销售业务。该公司的 产品包括拉舍尔毛毯、床单、面料等。湖北迈亚使用“仙桃”牌商标。该公司亦从事云基础 服务，包括云储存以及云计算。,96
1985,000972.SZ,中基健康产业股份有限公司主营药品、生物医药、生物制品、生物传感器、医疗器械、体外 诊断试剂产业项目的投资、开发和经营。,59
1986,000973.SZ,佛山塑料科技集团股份有限公司制造和生产商塑料产品。该公司生产和销售塑料薄膜、塑料 复合制品、食品包装薄膜、聚丙烯薄膜和其他相关产品。佛山塑料科技集团还生产粘胶制 品。,83
1987,000975.SZ,银泰资源有限公司经营有色金属的开采与分销业务。该公司开采并销售黄金、锡锭、白银、 铅和锌精矿，以及其他有色金属产品。银泰资源有限公司还提供相关的工程和技术咨询服 务。,83
1988,000976.SZ,广东华铁通达高铁装备股份有限公司生产铁路机车车辆设备。该公司生产制动安全设备、供 水卫生系统、火警系统、刹车盘、轨道门、铁路电力系统、钩缓系统和其他设备。广东华铁 通达高铁装备股份有限公司还生产纺织材料。,102
1989,000977.SZ,浪潮电子信息产业股份有限公司生产和销售计算机服务器、计算机终端产品、电子产品和通 信设备。该公司还开发计算机软件，提供系统集成服务并从事进出口贸易。,74
1990,000978.SZ,桂林旅游股份有限公司于广西桂林提供各类旅游服务。公司的服务包括游船经营、公路客 运、出租车服务和旅行社业务。,54
1991,000980.SZ,众泰汽车股份有限公司研发和生产汽车整车和汽车零部件。该公司生产传统汽车、新能源汽 车、发动机、电池、汽车传感器和防盗门。众泰汽车股份有限公司在中国、阿尔及利亚、智 利、俄罗斯等国家销售产品。,95
1992,000981.SZ,银亿股份有限公司制造汽车零配件。该公司主要生产和销售连续可变变速箱、汽车安全气 囊、燃气发电机组等。银亿股份还提供房地产开发、物业管理和其他服务。,73
1993,000982.SZ,宁夏中银绒业股份有限公司设计、生产和销售羊毛衫、羊绒制品和其他纺织品。该公司亦经 营房地产和兼营医药产品和有色金属的生产等。,62
1994,000983.SZ,山西西山煤电股份有限公司 提供煤矿开采和洗选服务。该公司生产生煤、焦煤和煤气产 品。山西西山煤电还从事发电和电力设备制造业务。,63
1995,000985.SZ,大庆华科股份有限公司生产和销售石油化工产品，包括聚丙烯、加氢戊烯、石油树脂和其他 相关产品。该公司兼营药品生产。,56
1996,000987.SZ,广州越秀金融控股集团股份有限公司主要从事百货零售业务。该公司为消费者提供饮食、服 装、电  子、珠宝、化妆品和电器产品等。广州越秀金融控股集团兼营物业租赁。,78
1997,000988.SZ,华工科技产业股份有限公司生产和销售激光设备、激光防伪产品、敏感电子元器件、光通信 器件和生物医药。该公司还开发计算机软件并提供计算机系统集成服务。,73
1998,000989.SZ,九芝堂股份有限公司主要从事中药的生产和销售。该公司的产品主要是肝炎和补血系列中 药。九芝堂兼营医药的批发和零售业务。,58
1999,000990.SZ,诚志股份有限公司生产和销售日用化工产品、生物科技产品、医药和信息科技产品。该公司 的产品包括“月月红”、“莎筠”洗衣粉、“草珊瑚”牙膏、D-核糖、L-谷氨酰胺、中成 药、计算机存储器和其他相关产品。诚志股份还使用“安乃诗”、“华仕广角”、“恒 威”、“提神”等品牌。,133
2000,000993.SZ,"福建闽东电力股份有限公司在福建闽东地区从事电力生产和开发。通过其子公司, 闽东电力 兼营自来水供应和酒店经营。",55
2001,000996.SZ,中国中期投资股份有限公司投资及管理电子信息及电子商务项目，现代服务项目，高新技术 项目，开发与服务金融信息软件。,56
2002,000997.SZ,新大陆数字技术股份有限公司制造电子交易设备。该公司生产销售点终端和其他产品。福建 新大陆数字技术还从事软件开发、房地产开发和其他业务。,67
2003,000998.SZ,袁隆平农业高科技股份有限公司培育和销售粮食、蔬菜、瓜果等的农作物种子。该公司还开 发和生产农用化工产品、经营酒店及从事房地产开发与投资。,68
2004,000999.SZ,华润三九医药股份有限公司生产和销售药品。该公司开发和销售处方药物、中药和其他相关 产品。华润三九医药股份有限公司还提供物流运输服务。,66
2005,001696.SZ,重庆宗申动力机械股份有限公司主要开发和销售各类发动机及零配件、机械产品、高科技产 品和热动力机。主要产品为摩托车发动机，迷你车发动机，快艇发动机，和一般用途机械。,81
2006,001872.SZ,招商局港口集团股份有限公司提供港口运营服务。该公司主要建设、经营和管理港口。招商 局港口集团还提供保税物流服务。,56
2007,001896.SZ,河南豫能控股股份有限公司主要从事电力生产和销售。该公司还承接环保、节能工程。,38
2008,001914.SZ,招商局积余产业运营服务股份有限公司经营房地产业务。该公司提供房屋装修、住房贷款、 房地产中介以及其他服务。招商局积余产业运营服务还经营投资、劳务派遣等业务。,78
2010,001979.SZ,招商局蛇口工业区控股股份有限公司是一家园区综合开发商。该公司从事土地和房地产开发 与管理、社区开发和其他服务。招商局蛇口工业区控股股份有限公司在中国提供服务。,79
2011,002001.SZ,浙江新和成股份有限公司主要从事有机化工产品及饲料添加剂的生产和销售。该公司主要产 品包括乙氧甲叉、维生素E、维生素A等。,60
2012,002002.SZ,鸿达兴业股份有限公司生产和分销化学产品。该公司生产聚氯乙烯（PVC）、改性PVC、苛性 钠、苏打碱、电石、土壤改良剂、盐酸、液氯和其他化学品。鸿达兴业还在全球范围内开展 化学品贸易、原材料分销和电子贸易业务。,104
2013,002003.SZ,浙江伟星实业发展股份有限公司生产纽扣、拉链及其他服装辅料。该公司还提供电镀服务。 浙江伟星使用“伟星”商标。,54
2014,002004.SZ,华邦生命健康股份有限公司研究和生产化学产品。该公司生产皮肤药物、心血管药物、眼科 药物和农药产品。华邦生命科学还从事旅游和医院运营业务。,68
2015,002005.SZ,广东德豪润达电气股份有限公司生产家用电器。该公司生产面包机、烤箱、电炸锅和其他产 品。德豪润达还生产发光二极管设备。,58
2016,002006.SZ,浙江精功科技股份有限公司生产制造建工、建材和纺织机械。该公司使用“精大”商标。,39
2017,002007.SZ,华兰生物工程股份有限公司主要生产及销售人血白蛋白、静注丙球、肌注丙球、冻干人凝血 酶原复合物(PCC)、冻干人凝血因子VIII浓制剂和肌注人乙型肝炎免疫球蛋白。,80
2018,002008.SZ,"大族激光科技产业集团股份有限公司主要生产激光信息标记设备、激光焊接机、激光切割机 和激光钻钻孔机。该公司拥有“大族”和 “HAN'S""商标 。",71
2019,002009.SZ,天奇自动化工程股份有限公司 生产和开发物流系统，包括自动化输送系统和自动化仓储 系统。该公司还从事环保工程施工。,56
2020,002010.SZ,传化智联股份有限公司生产化学品。该公司生产和销售印染助剂、化纤油剂、聚酯树脂、涂 料、合成橡胶和其他产品。传化智联还提供智能物流服务。,67
2021,002011.SZ,浙江盾安人工环境股份有限公司生产和分销制冷配件和控制组件。该公司生产商业空调、核 电取暖零件和传感器。浙江盾安人工环境有限公司还经营新能源和节能业务。,75
2022,002012.SZ,浙江凯恩特种材料股份有限公司生产和销售特种纸，包括电解电容器纸、双面胶带原纸、滤 纸原纸等。该公司使用“凯恩”和“KAN”等商标。,65
2023,002013.SZ,中航工业机电系统股份有限公司生产和销售航空产品。该公司生产飞行控制子系统、机载悬 架系统、航空机载燃油测量系统、机载液压致动器、发动机点火装置、无人机等产品。中航 工业机电系统股份有限公司还生产汽车产品。,102
2024,002014.SZ,黄山永新股份有限公司生产和销售彩印复合包装产品和真空镀铝膜产品。该公司使用“永 新”品牌。,45
2025,002015.SZ,协鑫能源科技股份有限公司从事清洁能源项目开发。该公司开发天然气发电、垃圾焚烧发 电、风力发电等项目。协鑫能源科技在中国提供服务。,64
2026,002016.SZ,广东世荣兆业股份有限公司从事房地产开发与经营。,23
2027,002017.SZ,东信和平智能卡股份有限公司生产各类智能卡并开发配套应用系统。该公司的产品用于电信 、身份识别、社会保障、金融、交通等领域。,61
2028,002019.SZ,亿帆医药股份有限公司从事精细化工产品生产。该公司的产品包括食品添加剂、药品生产、 精细化工产品、泛酸钙的加工、高分子材料及产品。该公司还提供技术开发与转让及技术咨 询与服务。,87
2029,002020.SZ,浙江京新药业股份有限公司生产和销售片剂、胶囊剂、注射液及其他医药产品。该公司的主 要产品是抗感染药物和心脑血管药物。京新药业使用“京新”、“京必利新”、“京新必 妥”等商标。,87
2030,002021.SZ,中捷资源投资股份有限公司生产和销售工业缝纫机及其配件。该公司的主要产品包括平缝机 、曲折缝机、包缝机等。,52
2031,002022.SZ,上海科华生物工程股份有限公司研究和生产生化试剂、医疗器械、诊断试剂和基因工程药 物。,42
