,company,intro,length
2867,002881.SZ,美格智能技术股份有限公司制造和分销通讯产品。该公司生产智能终端、无线通信模块、终 端精密组件和其他产品。美格智能技术还提供技术支持服务。,68
2868,002882.SZ,金龙羽集团股份有限公司生产和销售电线电缆产品。 该公司生产分支电缆、护套电缆、绝 缘电缆、计算机线缆、电力电缆和其他产品。,61
2869,002883.SZ,江苏中设集团股份有限公司提供工程服务。本公司提供工程规划、工程设计、 工程监理、工程测试、项目管理等服务。江苏中设集团业务涵盖至交通、市政、建筑、环境 等领域。,80
2871,002885.SZ,深圳市京泉华科技股份有限公司生产电子元器件。该公司主要开发，生产，和销售磁性元器 件，电源，特种变压器等。深圳市京泉华科技为全球客户提供服务。,71
2872,002886.SZ,深圳市沃特新材料股份有限公司制造先进材料。本公司生产高光免喷涂材料、纳米复合材料 及其他产品。深圳市沃特新材料还生产改性塑料。,63
2873,002887.SZ,天津绿茵景观生态建设股份有限公司是一家工程公司。本公司经营景观建设、苗圃建设、 景观设计、维修工程等项目。天津绿茵景观生态建设为全国各地的客户提供服务。,76
2874,002888.SZ,广州惠威电声科技股份有限公司生产电子产品。本公司生产家庭影院、数字家庭控制系统、 多媒体音响、互联网音响、汽车音响、专业音响、智能广播系统、扬声器等产品。广州惠威 电声科技股份在全中国销售其产品。,98
2875,002889.SZ,深圳市东方嘉盛供应链股份有限公司提供物流服务。该公司主要提供采购，报关，仓储，配 送，供应链管理等服务。深圳市东方嘉盛供应链为中国客户提供服务。,72
2876,002890.SZ,山东弘宇农机股份有限公司生产农机配件。本公司生产拖拉机液压升降机、液压缸、分配阀 等其他液压元件。山东弘宇农机股份在全球范围内销售其产品。,69
2877,002891.SZ,烟台中宠食品股份有限公司是一家宠物食品制造公司。该公司生产和销售宠物湿粮和干粮、 零食、训练奖励食品和其他产品。烟台中宠食品股份在全球销售其产品。,73
2878,002892.SZ,河南科力尔电机集团股份有限公司制造一般工业机械产品。该公司生产单相罩极异步电机、 单相串激电机、步进电机、贯流风机和和外转子电机。科力尔电机集团在全球各地开展业 务。,83
2879,002893.SZ,北京华远通热力科技股份有限公司是一家热力公司。该公司提供供暖管道的设计、管道建造 和管道改造服务。华通热力在中国提供服务。,61
2880,002895.SZ,贵州川恒化工股份有限公司是一家磷矿开采公司。该公司生产和销售磷酸盐产品、磷石膏建 筑材料、二水合铵及其他产品。贵州川恒化工还生产和销售饲料添加剂。贵州川恒化工在中 国各地销售其产品。,91
2881,002896.SZ,宁波中大力德智能传动股份有限公司是一家机电自动化公司。该公司从事马达传动装置、微 型电机、精密减速器、控制器以及齿轮的生产和销售。中大力德在中国各地销售其产品。,80
2882,002897.SZ,温州意华接插件股份有限公司生产和销售电子连接器。该公司提供网络和电子连接器、连接 线束、光电转换器及其他产品。温州意华接插件的产品销往世界各地。,72
2883,002898.SZ,珠海赛隆药业股份有限公司是一家制药公司。公司开发和销售米力农注射液、注射用脑蛋白 水解物、注射用泮托拉唑钠和其他产品。赛隆药业在中国各地销售其产品。,74
2884,002899.SZ,青岛英派斯健康科技股份有限公司是一家健身器材制造商。该公司生产并销售跑步机、椭圆 机、动感单车和其他产品。英派斯将其产品销往世界各地。,67
2885,002900.SZ,哈尔滨三联药业股份有限公司是一家制药公司。该公司致力于研发和制造和销售丙氨酰谷氨 酰胺注射液、脑蛋白水解物、葡萄糖注射液、氯化钠和其他产品。哈尔滨三联药业在中国各 地销售其产品。,89
2886,002901.SZ,大博医疗科技股份有限公司是一家骨科设备制造公司。该公司生产和销售理疗设备、骨科手 术器械、注射穿刺设备和其他产品。大博医疗在全中国销售其产品。,71
2887,002902.SZ,东莞铭普光磁股份有限公司是一家通信用品制造公司。该公司生产和销售通讯磁性元件、通 信光电组件、通信电源系统和其他产品。东莞铭普光磁在中国各地销售其产品。,76
2888,002903.SZ,宇环数控机床股份有限公司生产和销售工业机械。该公司生产磨削设备。宇环数控在中国、 越南、葡萄牙、俄罗斯、肯尼亚、巴西和其他国家销售其产品。,69
2889,002905.SZ,广州金逸影视传媒股份有限公司提供电影放映服务。该公司提供电影票销售、电影信息咨 询、广告和其他相关服务。广州金逸影视传媒还提供餐饮服务。广州金逸影视传媒在中国开 展业务。,85
2890,002906.SZ,惠州市华阳集团股份有限公司生产汽车电子产品。该公司生产和销售汽车音响设备、导航设 备、胎压监测系统、空气净化器、汽车车身控制模块和其他相关产品。华阳集团在中国各地 销售其产品。,88
2891,002907.SZ,重庆华森制药股份有限公司是一家制药公司。该公司开发和销售中药、处方药、颗粒、胶 囊、粉剂和其他产品。重庆华森的产品销往世界各地。,64
2892,002908.SZ,广东德生科技股份有限公司是一家电子设备制造公司。该公司提供智能卡设计、制造、销售 及其他相关服务。广东德生科技在中国各地销售其产品。,66
2893,002909.SZ,广州集泰化工股份有限公司生产化工产品。该公司开发和销售密封剂、涂料、沥青漆、防腐 漆和容器产品。广州集泰化工在中国销售其产品。,63
2894,002910.SZ,兰州庄园牧场股份有限公司是一个专业化乳制品生产企业。该公司进行集奶牛养殖、技术研 发、乳品加工和乳制品销售等。,55
2895,002911.SZ,佛燃能源集团股份有限公司是一家天然气生产公司。该公司制造和销售液化天然气、压缩天 然气和其他产品。佛燃能源集团还提供天然气高压管网建设服务。,70
2896,002912.SZ,深圳市中新赛克科技股份有限公司生产通讯产品。该公司研发、生产并销售宽带网络、移动 网络、网络内容安全、大数据运营和其他相关产品。深圳中新赛克还提供产品安装、调试、 培训和其他技术服务。,92
2897,002913.SZ,奥士康科技股份有限公司是一家电子元件制造公司。该公司设计、生产和销售高密度印刷电 路板。奥士康科技在全球范围内销售其产品。,61
2898,002915.SZ,浙江中欣氟材股份有限公司生产氟精细化学品。该公司设计、生产和销售基于氟的医药中间 体、杀虫剂、聚合物材料和其他相关化学品。中欣氟材在中国各地销售其产品。,76
2899,002916.SZ,深南电路有限公司生产印刷电路板。该公司生产包装底板、衬底、电子组件和其他产品。深 南电路在中国销售其产品。,53
2901,002918.SZ,蒙娜丽莎集团股份有限公司生产陶瓷产品。该公司生产和销售墙砖和地砖、陶瓷板、陶艺以 及其他产品。蒙娜丽莎集团在全球销售其产品。,62
2902,002919.SZ,名臣健康用品股份有限公司制造和销售个人医疗保健产品。该公司开发、生产和销售皮肤和 护发产品。名臣健康在中国各地销售其产品。,61
2903,002920.SZ,惠州市德赛西威汽车电子股份有限公司制造和销售汽车零部件。该公司生产汽车信息娱乐系 统、空调控制器、驾驶员信息显示屏、驾驶辅助系统和其他产品。惠州德赛西威在中国各地 销售其产品。,88
2904,002921.SZ,山东联诚精密制造股份有限公司制造精密机械零部件。该公司开发和制造铁、铝和其他金属 铸件产品，用于乘用车、商用车、压缩机、农业和建筑机械、液压系统等。山东联诚在全球 销售其产品。,88
2905,002922.SZ,伊戈尔电气股份有限公司生产电子元器件。该公司生产和销售发光二极管（LED ）驱动器、 LED应用产品、开关电源、电源变压器、电感器、电抗器、配电变压器及其他产品。伊戈尔 电气股份公司在世界各地营销其产品。,102
2906,002923.SZ,珠海润都制药股份有限公司生产和销售药品。该公司生产化学药品制剂、医药原料和医药中 间体。珠海润都制药在中国各地销售其产品。,61
2907,002925.SZ,厦门盈趣科技股份有限公司提供电子制造服务。该公司生产和销售智能控制组件、创新消费 电子、汽车电子产品和其他产品。厦门盈趣科技股份有限公司在中国各地销售其产品。,79
2908,002926.SZ,华西证券股份有限公司经营证券业务。该公司提供证券经纪、证券承销、资产管理、信用交 易、融资和证券咨询服务。华西证券还从事基金承销和期货中间介绍业务。,74
2909,002927.SZ,贵州泰永长征技术股份有限公司生产断路器产品。该公司生产和销售通用断路器、塑料外壳 断路器和微型断路器。贵州泰永长征技术公司在中国各地销售其产品。,72
2910,002928.SZ,华夏航空股份有限公司提供航空运输服务。该公司提供航空客货运、航空设备维护和飞机租 赁、机票和酒店的预订和咨询及其他服务。华夏航空为全球客户提供服务。,74
2911,002929.SZ,润建通信股份有限公司提供通信技术服务。该公司提供通信网络建设、网络维护、网络优化 服务和其他服务。润健通信在中国各地经营业务。,63
2912,002930.SZ,广东宏川智慧股份有限公司是一家物流公司。该公司提供仓库、装、卸、灌桶、石化产品的 增值服务以及其他服务。广东宏川智慧公司为中国大陆和香港的客户提供服务。,76
2913,002931.SZ,浙江锋龙电气股份有限公司生产和配送汽车零部件。该公司生产汽缸、汽车电气设备和其他 产品。浙江锋龙电气还生产电机、电器等产品。,62
2914,002932.SZ,武汉明德生物科技股份有限公司是一家体外诊断制造公司。该公司研究和开发POCT快速诊断 试剂和其他相关设备。武汉明德生物科技股份有限公司在亚洲、欧盟、南美和其他相关地区 销售其产品。,90
2915,002933.SZ,北京新兴东方航空装备股份有限公司生产飞机零件。该公司生产和销售空中悬架、飞机信息 管理和记录系统、综合测试和保证及其他产品。北京新兴东方航空设备在中国各地销售其产 品。,84
2916,002935.SZ,成都天奥电子股份有限公司开发和生产卫星应用产品。该公司生产原子钟、频率板、频率组 件、时间同步设备和其他相关产品。天奥电子向航空航天、卫星导航、军事通信和其他领域 供应产品。,87
2917,002936.SZ,郑州银行提供银行服务。该银行提供存款、贷款、信用卡、外币结算和其他服务。郑州银行 为个人、公司和其他团体提供服务。,57
2918,002937.SZ,宁波兴瑞电子科技股份有限公司生产电器元件。该公司生产汽车连接器、通讯天线、汽车传 感器、通讯天线、高频连接器、插座等产品。宁波兴瑞电子科技还生产塑料、五金配件及其 他产品。,86
2919,002938.SZ,鹏鼎控股（深圳）股份有限公司制造印刷电路板。该公司生产高密度连接、柔性印刷电路 板、硬式印刷电路板以及其他产品。鹏鼎控股（深圳）的产品用于通信设备、电机、电子设 备和其他设备。,88
2920,002939.SZ,长城证券股份有限公司是一家证券公司。该公司提供证券经纪、投资咨询、资产管理和其他 服务。长城证券在中国各地提供服务。,58
2921,002940.SZ,浙江昂利康制药股份有限公司生产医疗产品。该公司生产制剂、散装药剂、空胶囊和其他产 品。浙江昂利康制药还经营生物医药技术开发。,62
2922,002941.SZ,新疆交通建设集团股份有限公司经营基础设施建设业务。该公司参与和建造高速公路、桥 梁、交通安全设施、市政工程等项目。新疆交通建设集团还提供工程测试、物流、机械租 赁、设备采购等业务。,90
2923,002942.SZ,浙江新农化工股份有限公司生产和销售农用化学品。该公司生产杀菌剂、杀虫剂、除草剂和 其他产品。浙江新农化工在全球销售其产品。,61
2924,002943.SZ,湖南宇晶机器股份有限公司生产加工机床。该公司生产和销售单面研磨抛光机、双面研磨抛 光机、多线锯机和其他产品。湖南宇晶机器股份有限公司主要在中国各地和部分海外地区销 售其产品。,87
2925,002945.SZ,华林证券股份有限公司是一家证券公司。该公司提供证券承销、证券经纪、证券投资咨询、 证券交易等服务。华林证券在中国各地提供服务。,63
2926,002946.SZ,新希望乳业股份有限公司生产乳制品。该公司生产低温牛奶、酸奶、乳饮品、纯牛奶、奶粉 等产品。新希望乳业还经营奶源基地开发。,60
2927,002947.SZ,苏州恒铭达电子科技股份有限公司制造和设计消费电子功能设备。该公司生产粘合、固定、 屏蔽、绝缘、缓冲、散热、防尘、防护和其他功能设备。苏州恒铭达电子科技股份有限公司 为手机、平板电脑和笔记本电脑行业提供产品。,103
2928,002948.SZ,青岛银行股份有限公司提供银行服务。该公司提供存款、贷款、国内结算、外汇、资金管理 和其他服务。青岛银行为个人、企业和其他客户提供服务。,67
2929,002949.SZ,深圳市华阳国际工程设计股份有限公司提供建筑相关的专业服务。该公司提供建筑设计、建 筑技术咨询、工程造价、咨询和其他服务。深圳市华阳国际工程设计在中国提供服务。,79
2930,002950.SZ,奥美医疗用品股份有限公司制造一次性医用耗材。该公司生产并销售纱布片、纱布球、腹部 垫、手术巾、神经手术片、组合包、一次性乳垫及其他产品。奥美医疗的产品销往世界各 地。,83
2931,002951.SZ,四川金时科技股份有限公司生产纸包装产品。该公司生产烟盒、高档纸、纸板、激光纸、镀 铝纸等产品。四川金时科技还生产新型电容薄膜、功能性隔膜、反渗透膜、多功能膜、激光 膜等产品。,87
2932,002952.SZ,亚世光电股份有限公司是一家液晶显示产品制造公司。该公司开发、生产和分销液晶显示 屏、液晶显示模块和其他产品。亚世光电在全球销售其产品。,67
2933,002953.SZ,广东日丰电缆股份有限公司制造电缆和电线。公司生产和销售通信电缆控制电缆、仪表电 线、海事工程电线、机器电线及其他产品。广东日丰电缆股份有限公司在中国各地销售产 品。,82
2934,002955.SZ,鸿合科技股份有限公司开发多媒体音频视觉解决方案。该公司专门从事多媒体音频和视频产 品、系统集成及技术开发的推广和传播。鸿合科技股份有限公司为全球教育与音频视觉行业 提供服务。,87
2935,002956.SZ,桂林西麦食品股份有限公司开发、制造并销售燕麦产品。该公司生产即食燕麦片、燕麦饮料 和其他相关产品。桂林西麦在中国各地销售其产品。,64
2936,002957.SZ,深圳科瑞技术股份有限公司制造和销售电力自动化设备。该公司生产自动化测试和组装设 备、自动化设备配件和其他相关产品。深圳科瑞技术在全球销售其产品。,72
2937,002958.SZ,青岛农村商业银行股份有限公司提供银行服务。该公司提供存款、贷款、国际结算、财富管 理、票据贴现和其他服务。青岛农村商业银行向个人、企业和其他客户提供服务。,77
2938,002959.SZ,小熊电器股份有限公司生产和分销家用电器设备。该公司生产酸奶机、电炊具、健康锅、加 湿器和其他相关产品。小熊电器在中国销售产品。,63
2939,002960.SZ,青鸟消防股份有限公司生产和销售消防安全系统产品。该公司开发和生产消防自动报警联动 控制系统、电气消防监控系统、燃气自动灭火系统等产品。青鸟消防股份有限公司在中国各 地销售其产品。,89
2940,002961.SZ,瑞达期货股份有限公司是一家期货公司。该公司经营金融期货经纪、商品期货经纪、期货投 资咨询、资产管理和其他业务。瑞达期货在中国提供服务。,67
2941,002962.SZ,湖北五方光电股份有限公司生产和销售精密光电薄膜组件。该公司生产红外截止滤光片、生 物滤光片和其他产品。湖北五方光电主要向手机摄像头、计算机摄像头、汽车摄像头和其他 数字成像领域提供产品。,93
2942,002963.SZ,豪尔赛科技集团股份有限公司提供照明工程服务。该公司专注于建筑和景观照明设计和工程 建设领域。豪尔赛科技集团还从事喷泉设计和建筑业务。,66
2943,002965.SZ,祥鑫科技股份有限公司生产和销售精密冲压模具和金属结构件。该公司生产和销售超高强度 钢板、新能源汽车铝镁合金轻质零件等产品。祥鑫科技在中国各地销售其产品。,76
2944,002966.SZ,苏州银行股份有限公司提供银行服务。该公司提供存款、贷款、投资银行、货币交易、信用 卡发放、总额结算和其他银行服务。苏州银行为个人、企业和其他客户提供服务。,77
2945,002967.SZ,广州广电计量检测股份有限公司是一家计量检测公司。该公司提供环保测试、电磁兼容性和 安全性检测、农产品检测、消费品测试等服务。广州广电计量检测股份公司还提供技术培训 和咨询服务。,88
2946,002968.SZ,重庆新大正物业集团股份有限公司提供物业管理服务。该公司提供医院物业管理、商业房地 产管理、住宅物业管理、公共租赁物业管理、学校物业管理和其他。重庆新大正物业集团在 中国提供服务。,89
2947,002969.SZ,嘉美食品包装（滁州）股份有限公司制造和分销包装和容器。该公司生产食品罐、饮料罐、 马口铁罐、金属容器和其他产品。嘉美食品包装（滁州）还提供印刷服务。,74
2948,002970.SZ,深圳市锐明技术股份有限公司是一家移动监控制造商和解决方案提供商。该公司开发和生产 车辆监控设备、摄像头、出租车监控终端、危险商品监控设备等。锐明技术为全球客户提供 其产品。,86
2949,002971.SZ,湖北和远气体股份有限公司回收、制造和销售各种气体产品。该公司生产医用氧气、工业氧 气、氮气，氩气，氢气，氦气，混合气体，丙烷等。湖北和远气体为化工、食品、照明、钢 铁、农业、电信、医疗等领域供应其产品。,101
2950,002972.SZ,深圳科安达电子科技股份有限公司生产和销售轨道交通产品。该公司生产轨道交通信号计轴 系统、铁路防雷系统、道岔融雪系统等轨道产品。深圳科安达电子科技还提供相关的系统解 决方案。,86
2951,002973.SZ,侨银环保科技股份有限公司提供环境工程和咨询服务。该公司提供渗滤液运输与处理、生物 质废物处理和其他服务。侨银环保科技在中国各地提供服务。,68
2952,002975.SZ,珠海博杰电子股份有限公司生产工业自动化设备及配件。该公司生产自动取物装置、折叠机 和声学测试设备。珠海博杰电子向消费电子、汽车电子、医疗电子领域供应其产品。,78
2953,002976.SZ,苏州瑞玛精密工业股份有限公司生产和销售精密金属结构部件。该公司生产移动通信金属部 件、汽车金属零件、电子金属零件、模具及其他产品。苏州瑞玛精密工业股份有限公司在亚 洲、欧洲等地区销售其产品。,95
2954,002977.SZ,成都天箭科技股份有限公司生产航空航天产品。该公司生产高功率固态发射器、相控阵天 线、微波元件和其他产品。成都天箭科技股份有限公司还经营进出口业务。,73
2955,002978.SZ,四川安宁铁钛股份有限公司加工并分销矿产品。该公司生产铁精矿、钒钛精矿、钛精矿、硫 钴精矿等产品。四川安宁铁钛股份有限公司还经营矿产资源综合利用业务。,74
2956,002979.SZ,深圳市雷赛智能控制股份有限公司设计、生产和分销电动机控制产品。该公司生产运动控制 器、控制系统、集成伺服系统、伺服系统驱动机、伺服系统电机、	步进电机驱动系统等产 品。深圳市雷赛智能控制在亚洲、欧洲、美国、澳大利亚等地区销售产品。,115
2957,002980.SZ,深圳市华盛昌科技实业股份有限公司从事测量测试仪器仪表的技术研究、设计开发、生产和 销售。该公司生产各类电量、机械量、热工量、化工量、声学量、光学量、放射性量参数的 测量。深圳市华盛昌科技实业客户遍布全球。,102
2958,002981.SZ,广东朝阳电子科技股份有限公司制造和销售电子产品。该公司生产插线、电声产品、耳机、 耳机皮套等产品。广东朝阳电子科技还生产智能设备、模具等产品。,71
2959,002982.SZ,湖南湘佳牧业股份有限公司经营家禽业务。该公司生产鸡肉、鸭肉和其他产品。湖南湘佳牧 业还经营家禽饲养、肉类加工和其他业务。,60
2960,002983.SZ,安徽芯瑞达科技股份有限公司生产和销售照明装置。该公司生产家用照明、商业照明、工业 照明等相关产品。安徽芯瑞达科技还生产发光半导体产品。,67
2961,002985.SZ,北京北摩高科摩擦材料股份有限公司生产和销售飞机零件。该公司生产飞机制动控制系统、 飞机轮子和其他相关产品。北京北摩高科摩擦材料还提供航空维护和辅助服务。,76
2962,002987.SZ,京北方信息技术股份有限公司提供信息技术服务。该公司提供数据处理、互联网融资解决方 案、软件开发和测试以及现金服务。京北方信息技术还从事IT运营和支持业务。,77
2963,002988.SZ,广东豪美新材股份有限公司制造和分销铝制品。该公司生产铝型材、铝模板、铝建材、铝搁 板和其他产品。广东豪美新材在中国各地销售其产品。,65
2964,002990.SZ,盛视科技股份有限公司开发系统解决方案产品。该公司生产智慧口岸系统、智慧交通系统、 数字城市管理系统、数字文件管理系统等系统产品。盛视科技向政府、公共安全、交通、大 型企业等领域供应其产品。,94
2965,003816.SZ,中国广核电力股份有限公司经营和管理核能发电站。该公司经营和管理核电站、销售电力、 核电站建设管理和其他服务。中国广核电力股份有限公司在中国提供服务。,74
2966,200011.SZ,深圳市物业发展（集团）股份有限公司开发和管理房地产。该公司兼营百货商店、提供出租 车运输并从事酒店和餐馆管理。,55
2967,200012.SZ,中国南玻集团股份有限公司生产玻璃产品。该公司生产工程玻璃、浮法玻璃、镀膜玻璃、隔 热玻璃、夹层安全玻璃、建筑玻璃、太阳能板玻璃和其他产品。南玻集团还生产硅材料、光 伏模块和其他产品。,91
2968,200016.SZ,康佳集团股份有限公司主要生产和销售彩色电视机、数字移动电话、液晶显示器和家用电 器。,42
2969,200017.SZ,深圳中华自行车(集团)股份有限公司生产和销售自行车及其零配件。该公司兼营物业管理。,41
2970,200019.SZ,深圳市深粮控股股份有限公司制造和销售调味品、饮料和罐装食品。该公司还从事国内和进 出口交易及物业开发。,51
2971,200020.SZ,深圳中恒华发股份有限公司生产和销售电子产品包括电路板、彩色电视机和注塑件。该公司 同时也经营房地产投资。,52
2972,200025.SZ,深圳市特力（集团）股份有限公司主要从事进出口贸易。该公司也生产机械、电子与家用电 器，并提供汽车维修和检测服务。该公司兼营房地产开发及投资。,70
2973,200026.SZ,飞亚达精密科技股份有限公司批发和销售钟表。该公司提供石英手表、艺术钟表、防磨宝石 手表和其他产品。飞亚达精密科技股份还提供精密产品制造、维修等服务。,74
2974,200028.SZ,国药集团一致药业股份有限公司开发和生产医药产品。该公司还批发和零售专利药物、中成 药、生物制品、保健品和医疗器械。,57
2975,200029.SZ,深圳经济特区房地产（集团）股份有限公司主要从事房地产的开发、销售、出租和管理。该 公司兼营建筑装饰安装、商品零售及贸易和酒店及餐饮服务。,68
2976,200030.SZ,富奥汽车零部件股份有限公司主要生产和销售汽车零部件。,26
