,company,intro,length
0,600000.SH,上海浦东发展银行股份有限公司提供银行服务。该公司提供贷款、存款、账户结算、外汇和 其他服务。浦发银行为个人、公司和其他团体提供服务。,66
1,600004.SH,广州白云国际机场股份有限公司提供机场辅助服务。该公司提供地面清洁、飞机保养、飞机 维修和其他服务。广州白云国际机场股份有限公司还提供餐饮、场地出租和广告等服务。,80
2,600006.SH,东风汽车股份有限公司设计、生产和销售柴油发动机、轻型卡车、铸件和相关零部件。该公 司的产品使用“东风”品牌。,54
3,600007.SH,中国国际贸易中心股份有限公司提供房地产服务。该公司经营办公楼租赁业务、购物商城租 赁业务、公寓租赁业务、酒店管理业务和其他相关业务。中国国际贸易中心在中国提供服 务。,83
4,600008.SH,北京首都创业股份有限公司提供供水服务。该公司提供水输送、供水系统管理、供水网络维 护等服务。首创股份还经营环境控制、绿色资源开发和其他业务。,70
5,600009.SH,上海国际机场股份有限公司经营上海虹桥机场和浦东机场。该公司提供地面保障、机场管 理、货物处置、广告、场所出租和其他相关服务。,62
6,600010.SH,内蒙古包钢钢联股份有限公司主要从事黑色金属的冶炼和压延加工。该公司的产品包括钢 板、无缝钢管、重轨、方钢、线材、带钢、废铁和其他相关产品。内蒙古包钢钢联股份有限 公司还提供进出口服务。,92
7,600011.SH,华能国际电力股份有限公司提供发电服务。该公司提供输电、配电、变电及其他相关服务。 华能国际电力在中国提供服务。,55
8,600012.SH,安徽皖通高速公路有限公司持有、经营及开发中国安徽省內的收费高速公路及公路。,37
9,600015.SH,华夏银行股份有限公司经营银行业务。该公司提供存款、贷款、结算、票据贴现、外汇交 易、银行担保、财富管理和其他服务。华夏银行为企业和个人提供服务。,72
10,600016.SH,中国民生银行股份有限公司经营商业银行业务。该公司提供存款、贷款、结算、贴现、金融 债券发行、政府债券承销和交易、信用证、银行担保和其他相关金融服务。中国民生银行股 份有限公司在全球提供服务。,95
11,600017.SH,日照港股份有限公司从事港口管理和运营业务。该公司提供货物仓储、装卸、运输和转运服 务。日照港提供煤、水泥、钢铁材料、矿物和木制品的港口服务。,70
12,600018.SH,上海国际港务（集团）股份有限公司提供港口运营服务。该公司提供货物装卸、港口物流、 港口商务、领航、拖轮、航运理货，以及其他港口相关服务。上港集团为全球客户提供服 务。,83
13,600019.SH,宝山钢铁股份有限公司生产和销售铁钢产品。该公司生产和销售冷轧板卷、热轧板卷、无缝 钢管、高速线材、钢坯和其他产品。宝山钢铁在中国各地销售其产品。,72
14,600020.SH,河南中原高速公路股份有限公司经营高速公路业务。该公司提供收费高速公路的投资、建设 和维护服务。中原高速还从事房地产开发、石油输送和技术服务。,70
15,600021.SH,上海电力股份有限公司经营发电业务。该公司生产电力、火电和其他电力产品。上海电力还 经营工程承包、新能源开发和其他业务。,59
16,600022.SH,山东钢铁有限公司生产和销售钢材，钢坯，生铁，及其他相关产品。,30
17,600023.SH,浙能电力属于电力、热力生产业。公司经营范围主要包括电力开发，经营管理，电力及节能 技术的研发、技术咨询、节能产品销售，电力工程、电力环保工程的建设和监理，电力设备 检修，实业投资，资产管理。,95
18,600025.SH,华能澜沧江水电股份有限公司提供水力发电服务。该公司提供输电、配电、变电及其他相关 服务。华能澜沧江水电股份有限公司还提供清洁能源开发服务。,69
19,600026.SH,中远海运能源运输股份有限公司是一家航运公司。该公司主要经营原油、煤炭和天然气的海 运业务。中远海运能源运输股份有限公司为全球客户提供服务。,69
20,600027.SH,华电国际电力股份有限公司从事电力业务。该公司提供发电厂建设、水力发电、风力发电及 太阳能发电服务。华电国际还从事电力输送和配送业务。,66
21,600028.SH,中国石油化工公司生产并从事石油与石化产品贸易。该公司提供汽油、柴油、航空燃油、煤 油、乙烯、合成纤维、合成橡胶、合成树脂和化肥。中国石化在中国各地销售其产品。,79
22,600029.SH,中国南方航空股份有限公司提供航空运输服务。该公司提供客运和货运服务、航空设备维护 和飞机租赁服务。南方航空还提供票务和酒店预订及咨询服务。南方航空在全球范围内提供 服务。,85
23,600030.SH,中信证券股份有限公司提供证券代理买卖、自营买卖、证券承销和上市推荐、资产管理和投 资咨询服务。该公司使用“中信证券”和“CITICS”商标。,70
24,600031.SH,三一重工股份有限公司生产并销售建筑工程机械及相关部件。该公司生产并销售混凝土泵、 混凝土泵车辆、压路机、铺路机等相关产品。三一重工在全球范围内销售产品。,76
25,600033.SH,福建发展高速公路股份有限公司提供基础设施建设服务。该公司建造公路和其他基础设施。 福建发展高速公路股份有限公司还经营设备租赁、建设投资和其他业务。,73
26,600035.SH,湖北楚天智能交通股份有限公司提供收费公路运营服务。该公司提供路桥投资、建设和维护 服务。湖北楚天智能交通股份有限公司还生产和出口移动智能通信终端、移动医疗终端和车 联网终端。,87
27,600036.SH,招商银行股份有限公司是一家商业银行。该公司提供存款、贷款、财富管理、资产保管、金 融租赁、投资银行和其他银行服务。招商银行在国内和国际开展业务。,72
28,600037.SH,北京歌华有线电视网络股份有限公司建设、管理和维护有线电视网络。该公司还提供广告和 信息服务。,46
29,600038.SH,中航直升机股份有限公司主要从事直升飞机、飞机零部件和航空产品的生产和销售业务。该 公司兼营汽车零件生产。,52
30,600039.SH,四川路桥建设集团股份有限公司提供基础设施建设服务。该公司建造道路、桥梁、隧道及其 他工程项目。四川路桥建设集团股份有限公司还经营发电业务。,69
31,600048.SH,保利房地产（集团）股份有限公司经营房地产业务。该公司提供房地产投资、房地产开发、 经纪和房地产金融服务。保利房地产（集团）还从事文化旅行、会议、医疗保健和教育业 务。,83
32,600050.SH,"中国联合网络通信股份有限公司提供各类通信服务，包括GSM和CDMA移动通信服务、国际 国内长途通信服务、数据通信和互联网服务以及寻呼服务。该公司使用""UNICOM""和""联通"" 商标。",91
33,600051.SH,宁波联合集团股份有限公司是一家投资控股公司。通过其子公司，该公司从事基础设施建 设，房地产开发、进出口贸易、汽车和一般商品贸易、药物制造、电器生产和饮食服务。,79
34,600052.SH,浙江广厦股份有限公司主要从事房地产开发并承接建筑施工项目。该公司还提供旅游服务和 从事物业管理。,48
35,600053.SH,昆吾九鼎投资控股股份有限公司从事私募股权投资。该公司投资于信息技术、互联网、医疗 保健和其他领域。昆吾九鼎投资控股还经营房地产开发和销售业务。,71
36,600054.SH,黄山旅游发展股份有限公司主要从事旅游行业。该公司提供索道运输服务、出售园林门票、 经营酒店并提供旅游服务。,53
37,600055.SH,万东医疗装备股份有限公司生产和销售医疗设备。该公司生产医疗成像设备、X射线设备、 高频数字胃肠设备与共振成像机。万东医疗装备股份有限公司还提供兽医成像解决方案及医 疗设备维护服务。,90
38,600056.SH,中国医药健康产业股份有限公司主要从事成套设备的进出口业务，包括医疗设备、造纸机械 、铝材挤压机等。该公司还引进各类专利技术和生产工艺技术。,69
39,600057.SH,厦门象屿股份有限公司提供物流服务。该公司提供物流平台开发、国际中转、仓储和其他服 务。厦门象屿股份有限公司还从事进出口业务。,62
40,600058.SH,五矿发展股份有限公司主要从事五金矿物的进出口业务。该公司进口钢材 、矿砂、钢坯 等 ，出口焦炭、煤炭、生铁和氟石等。五矿发展还经营货物运输、酒店管理等 。,77
41,600059.SH,浙江古越龙山绍兴酒股份有限公司生产和销售“古越龙山”牌黄酒、白酒、饮料、食品和食 品原辅料。通过其子公司，该公司兼营氨纶生产和餐饮服务。,68
42,600060.SH,海信视像科技股份有限公司制造和销售电子产品及家用电器。该公司生产电视机、冰箱、冰 柜和通讯产品。海信视像科技在中国开展业务。,62
43,600061.SH,国投资本股份有限公司经营金融投资和管理业务。该公司专注于证券、信托、基金、期货、 保险和其他金融领域。国投资本股份有限公司还从事投资银行和其他自营业务。,76
44,600062.SH,华润双鹤药业股份有限公司开发，制造和销售各种医疗产品。该公司的产品包括抗流感，抗 高血压药，抗生素。,50
45,600063.SH,安徽皖维高新材料股份有限公司生产和分销化学产品。该公司生产聚酯切片、乙酸乙烯酯、 乙酸甲酯、聚乙烯醇缩丁醛和聚乙烯醇纤维产品。皖维高新还从事建筑材料生产业务。,79
46,600064.SH,南京高科股份有限公司是一家房地产开发公司。该公司开发和销售高层住宅楼、低层公寓、 别墅、商业设施、办公楼和其他相关领域。南京高科股还从事医药制造业务。,75
47,600066.SH,郑州宇通客车股份有限公司生产和分销客车产品。该公司生产长途客车、城市观光车、校 车、机场大巴和其他特殊用途用车。郑州宇通客车在国内外销售其产品。,72
48,600067.SH,冠城大通股份有限公司经营房地产业务。该公司提供房屋翻修、房屋贷款、房地产中介和其 他服务。冠城大通还从事专用漆包线生产、新能源开发和其他业务。,71
49,600068.SH,中国葛洲坝集团股份有限公司提供基础设施建设服务。该公司提供新能源工程建设、水资源 和水力工程建设、绿化建设和其他相关服务。中国葛洲坝集团还生产环保材料。,76
50,600069.SH,河南银鸽实业投资股份有限公司生产和分销纸张产品。该公司生产家庭用纸、文化用纸、包 装纸、纸板和专业纸质产品。河南银鸽实业投资控股在国内和国际销售其产品。,76
51,600070.SH,浙江富润股份有限公司主要生产和销售绢纺产品、呢绒产品、针纺织品以及设计和生产服装 产品。该公司兼营医药的销售及收费公路。,60
52,600071.SH,凤凰光学股份有限公司生产和销售各类光学和摄影器材。该公司的产品包括照相机、望远 镜、光学镜头及其他相关产品。该公司使用“凤凰”品牌。,66
53,600072.SH,中船钢构工程股份有限公司主要制造和销售大型建筑用和交通工具用钢结构产品。 该公司 还生 产压力容器、船配件、电器设备和港口机械等。,65
54,600073.SH,上海梅林正广和股份有限公司生产和销售罐头食品、饮用水、调味品、冷冻食品和其他相关 产品。该公司的产品使用“梅林”、“正广和”、“光明”和“85818”品牌。,78
55,600075.SH,新疆天业股份有限公司主要从事塑料制品和氯碱化工产品的生产和销售。该公司还种植农作 物和加工农副产品，包括棉花、小麦、西红柿和糖等。新疆天业兼营货物运输和供水供电业 务。,84
56,600076.SH,康欣新材料股份有限公司主要从事集装箱底板等木质复合材料的研发、生产和销售，以及营 林造林和优质种苗培育、销售。主要产品包括杨木复合集装箱底板、竹木复合集装箱底板、 COSB复合集装箱底板、建筑模板、环保板等各类优质、新型木质复合材料，以及速生杨种苗 ，石楠、雪松、桂花等多种绿化种苗及景观树等林产品。,150
57,600077.SH,宋都基业投资股份有限公司从事房地产开发与销售，生产和销售通讯电源设备、半导体制冷 产品、干燥设  备、自动化仓储设备和制米机械。该公司还开发计算机软件和提供系统集成 服务。,86
58,600078.SH,江苏澄星磷化工股份有限公司生产和销售磷酸、磷酸盐等磷化工产品。,31
59,600079.SH,人福医药集团股份公司开发与销售药品。该公司生产和销售麻醉、止痛、中央神经系统药物 和其他产品。人福医药集团股份公司在全球销售其产品。,66
60,600080.SH,金花企业（集团）股份有限公司主要从事生物制药和保健品的生产和销售。公司兼营商业广 场的出租业务。该公司拥有“金花”品牌。,60
61,600081.SH,东风电子科技股份有限公司生产和销售汽车部件和仪器，包括传感器、轴承、阀门和其他相 关产品。通过其子公司，该公司还经销汽车及其配件。,65
62,600082.SH,天津海泰科技发展股份有限公司是一家建筑材料销售公司。该公司销售钢材产品和其他产 品。天津海泰科技发展还从事房地产销售、租赁和其他业务。,67
63,600083.SH,江苏博信投资控股股份有限公司设计并开发人工智能电子产品。该公司生产智能电话、智能 硬件设备、电动牙刷、美容仪、智能音箱以及儿童智能手表产品。江苏博信投资控股还从事 跨境电商业务。,89
64,600084.SH,中信国安葡萄酒业股份有限公司从事葡萄酒酿造，农产品生产及房地产开发和销售。,37
65,600085.SH,北京同仁堂股份有限公司开发、生产和销售中国传统药物和药酒。该公司还经营医药零售和 提供咨询服务。同仁堂生产的产品使用“同仁堂”品牌。,66
66,600086.SH,湖北东方金钰股份有限公司设计和加工珠宝产品。该公司生产玉器、金条和其他首饰。东方 金钰还从事互联网金融业务。,54
67,600088.SH,中视传媒股份有限公司主要从事电视剧和电视节目制作。该公司还在其影视拍摄基地经营主 题公园，并提供广告服务。,53
68,600089.SH,新疆特变电工股份有限公司生产和销售电器元件。该公司生产变压器、反应器、互感器和其 他产品。特变电工还生产新能源设备、新材料和其他产品。,67
69,600090.SH,新疆同济堂健康产业股份有限公司是一家以药品、保健品、医疗器械为主要经营产品，以医 疗机构、批发企业、零售药店为主要客户对象，并为客户提供信息、物流等各项增值服务的 大型企业。,87
70,600091.SH,包头明天科技股份有限公司生产和销售烧碱、聚氯乙烯树脂、苯酚、盐酸、硫酸、氢氟酸、 电石等化工产品；该公司也从事计算机软、硬件及外围设备的生产、销售。,74
71,600093.SH,易见供应链管理股份有限公司开发和管理供应链。该公司运营供应链企业融资、预付款、预 结算等业务。易见供应链管理股份有限公司还经营产品保理和区块链管理等业务。见供应链 管理股份有限公司在中国提供服务。,98
72,600094.SH,上海大名城企业股份有限公司经营房地产业务。该公司提供房屋销售、房屋贷款、物业管理 和其他服务。上海大名城企业股份有限公司还经营金融投资、造纸和其他业务。,76
73,600095.SH,哈尔滨高科技(集团)股份有限公司是一家投资控股公司。通过其子公司，该公司从事大豆深 加工、制药、防水卷材生产、房地产开发和管理以及商业贸易。哈高科生产的防水卷材使用 “矩圆”品牌。,90
74,600096.SH,云南云天化股份有限公司主要生产和销售化肥和其他化学产品。该公司的产品包括合成氨、 尿素、硝铵、季戊四醇、甲酸钠和聚甲醛等化学产品。云天化兼营玻璃纤维和浸润剂的生 产。,83
75,600097.SH,浙江开创国际海洋资源股份有限公司经营远洋捕捞，海淡水养殖；水产品加工和贸易.,38
76,600098.SH,广州发展集团股份有限公司销售煤炭产品。该公司销售褐煤产品、烟煤产品、硬煤产品、焦 煤产品和其他相关产品。广州发展集团还提供发电服务。,66
77,600099.SH,林海股份有限公司生产和销售摩托车、助力车、发动机、营林机械、喷灌机械、木材采运机 械、环保机械和相关配件。,53
78,600100.SH,清华同方股份有限公司批发消费类电子产品。该公司销售家用电脑、商用电脑、笔记本产 品、服务器、移动互联网终端等产品。清华同方股份有限公司还提供系统集成服务。,77
79,600101.SH,四川明星电力股份有限公司主要生产、传输和在中国西南销售电力。该公司兼营电网安装、 用水及天然气供应、貿易和酒店管理。,58
80,600103.SH,福建省青山纸业股份有限公司主要生产“青山”牌纸制品。该公司的产品包括纸袋、卡纸、 纸浆等。透过子公司，该公司还生产液碱、电力、光电产品、精细化工产品和医药产品， 从事商品贸易，并提供林业服务。青山纸业生产“水仙牌”风油精。,111
81,600104.SH,上海汽车集团股份有限公司生产和销售汽车及其零部件。该公司是汽车零部件生产商的控股 公司。上海汽车的主要产品包括汽车底盘、变速器、转向器、汽车悬架弹簧、ABS制动系统 和车灯。,87
82,600105.SH,江苏永鼎股份有限公司主要从事通信电缆、通信光缆、铜丝和其他通信产品的制造和销售。,40
83,600106.SH,重庆路桥股份有限公司提供基础设施建设服务。该公司提供公路建设、桥梁建设和其他相关 服务。重庆路桥股份有限公司还从事房地产开发业务。,65
84,600107.SH,湖北美尔雅股份有限公司主要从事纺织服装的生产和销售。该公司的产品包括“美尔雅”牌 西服、时装和毛纺织品。美尔雅兼营酒店管理。,62
85,600108.SH,甘肃亚盛实业(集团)股份有限公司提供农产品种植和加工服务。该公司种植啤酒花、马铃 薯、牧草、草本植物、葵花、辣椒、枸杞等产品。甘肃亚盛实业(集团)股份有限公司还生产 节水灌溉设备。,90
86,600109.SH,国金证券股份有限公司经营证券业务。该公司提供证券经纪、资产管理、固定收益、股权投 资以及投资银行服务。国金证券还从事投资咨询和资产托管业务。,70
87,600110.SH,诺德投资股份有限公司开发、生产和分销铜材料。该公司生产锂离子电池铜箔和其他锂电池 材料。诺德投资股份有限公司还生产和销售电缆和电线。,66
88,600111.SH,中国北方稀土（集团）高科技股份有限公司生产稀土产品。该公司生产稀土精矿、稀土金 属、稀土氧化物、新稀土材料和其他产品。北方稀土（集团）还从事进出口业务。,76
89,600112.SH,贵州长征天成控股股份有限公司生产和销售电器设备和元件。该公司的产品包括高、中、低 压电器元件及成套设备，风力发电设备的设计、研制、生产、销售及售后服务。,76
90,600113.SH,浙江东日股份有限公司主营生产及销售各类灯具及配件。该公司还从事实业投资、市场租赁 经营、计算机网络开发和物业管理等。,58
91,600114.SH,东睦新材料集团股份有限公司主要设计、生产和销售粉末冶金产品。该公司产品包括摩托车 配件、压缩机配件、电动工具配件、汽车配件和其他配件。,67
92,600115.SH,中国东方航空股份有限公司经营航空业务。该公司提供客运、航空货运、航空餐饮和其他相 关服务。东方航空在全球范围内开展业务。,60
93,600116.SH,重庆三峡水利电力(集团)股份有限公司从事水力发电和电力供应。该公司还生产节水产品并 提供安装和广告服务。,52
94,600117.SH,西宁特殊钢股份有限公司生产和分销特殊钢铁产品。该公司生产碳钢、复合钢、不锈钢等。 西宁特殊钢股份有限公司提供的产品用于汽车、铁路、轮船、石化、航空和采矿机械领域。,81
95,600118.SH,中国东方红卫星股份有限公司研发和制造卫星及相关产品。该公司还经营零售商场，酒店和 旅游资产。,46
96,600119.SH,长发集团长江投资实业股份有限公司从事物流业务。该公司提供货运、供应链、跨境电子商 务和其他物流服务。长发集团长江投资实业还经营物业管理和租赁、劳务和其他业务。,79
97,600120.SH,浙江东方集团股份有限公司从事纺织品进出口业务。该公司出口棉花、羊毛针织品、家用纺 织品、纺织品配饰等产品，并进口纺织品原料和设备。浙江东方集团还提供金融租赁、房地 产销售和其他服务。,91
98,600121.SH,郑州煤电股份有限公司生产和销售煤炭产品。该公司生产瘦煤、贫瘦煤、无烟煤和其他产 品。郑州煤电股份有限公司还经营铁路货运、货物装卸和其他业务。,70
99,600122.SH,江苏宏图高科技股份有限公司销售消费电子产品。该公司销售激光音频和视频产品、计算 机、网络设备、电缆、通讯设备和其他相关产品。宏图高科还从事工业制造、房地产、互联 网金融和其他业务。,90
100,600123.SH,山西兰花科技创业股份有限公司生产和销售煤炭和肥料。,25
101,600125.SH,中铁铁龙集装箱物流股份有限公司提供货运服务。该公司提供特殊集装箱运输、铁路货运、 港口物流等服务。铁龙物流还经营房地产开发业务。,64
102,600126.SH,杭州钢铁股份有限公司生产和销售钢铁制品包括生铁、钢坯和钢材。通过其子公司，该公司 还从事动力业务、开发计算机软件并提供水处理服务。,65
103,600127.SH,湖南金健米业股份有限公司主要生产、加工和销售“金健”牌米、面粉、和烹调油产品等。 该公司还从事乳品加工、药品以及开发房地产业务。,64
104,600128.SH,江苏弘业股份有限公司主要从事进出口业务。该公司经营的产品包括手工针织品和刺绣品、 帽子和玩具等。弘业股份出口产品至欧洲、日本、美国和加拿大等。,71
105,600129.SH,重庆太极实业(集团)股份有限公司生产和销售各类药物、保健品、医疗包装制品和医疗仪 器。该公司还进出口中药材和医疗包装制品。,61
106,600130.SH,宁波波导股份有限公司生产和销售移动电话、传呼机和太阳能电池。该公司在国内销售其产 品并使用“波导”品牌。,52
107,600131.SH,国网信息通信股份有限公司发电、输电和配电。该公司提供输电、电力系统管理、电网维护 等相关服务。国网信息通信股份有限公司为四川省阿坝州地区供电。,71
108,600132.SH,重庆啤酒股份有限公司主要从事啤酒的生产和销售。该公司拥有“重庆牌”和“山城牌”商 标。重庆啤酒兼营化学原料药和胶囊的生产。,61
109,600133.SH,武汉东湖高新集团股份有限公司提供基础设施建设服务。该公司提供工业区建设、工厂建设 等服务。武汉东湖高新集团股份有限公司还经营铬渣综合处理、发电、工厂贷款等业务。,80
110,600135.SH,乐凯胶片股份有限公司生产和销售彩色胶卷、相纸、电影胶片和其他感光材料。该公司的产 品使用“乐凯”品牌。,51
111,600136.SH,武汉当代明诚文化股份有限公司经营体育和文化业务。该公司提供运动营销、体育代理、俱 乐部运营、体育版权管理、体育视频平台运营服务。武汉当代明诚文化股份有限公司还从事 电视和电影制作、综艺节目和娱乐营销业务。,102
112,600137.SH,四川浪莎控股股份有限公司主要生产和销售工业包装纸，产品用于水泥、农药、粮食和电器 等工业。该公司还生产纸张检测仪器等。,59
113,600138.SH,中青旅控股股份有限公司提供旅游信息和旅程安排服务。通过其子公司，该公司还生产医疗 器械、为保险业提供系统集成服务并开发房地产。,63
114,600139.SH,四川西部资源控股股份有限公司开采和分销金属产品。该公司生产铜、黄金、白银和其他产 品。四川西部资源控股还经营资产管理、投资和其他业务。,67
115,600141.SH,湖北兴发化工集团股份有限公司生产和分销磷化学品。该公司生产黄磷、草甘膦、三氯化 磷、磷酸和其他化学品。湖北兴发化工集团的产品销往美国、日本、巴西和越南。,76
